{
  "trade_date": "2025-10-10",
  "issue_date": "2025-10-15",
  "maturity_date": "2026-12-30",
  "underlying_symbols": ["ABC"],
  "initial_levels": [100.00],
  "notional_amount": 1000000,
  "currency": "USD",
  "observation_dates": ["2025-12-30", "2026-03-30", "2026-06-30", "2026-09-30", "2026-12-23"],
  "coupon_observation_offset_days": 0,
  "coupon_payment_dates": ["2025-12-30", "2026-03-30", "2026-06-30", "2026-09-30", "2026-12-30"],
  "coupon_rate_pct": 0.05,
  "is_memory_coupon": false,
  "memory_carry_cap_count": null,
  "knock_in_barrier_pct": 0.70,
  "barrier_monitoring": "discrete",
  "knock_in_condition": "any-underlying-breach",
  "redemption_barrier_pct": 0.80,
  "settlement_type": "physical-settlement",
  "coupon_condition_threshold_pct": 0.80,
  "recovery_mode": "par-recovery",
  "day_count_convention": "ACT/365",
  "business_day_calendar": "TARGET",
  "fx_reference": null,
  "documentation_version": "1.0.0"
}
